{
  "id" : "43198de5-f56a-4a53-a0bd-5a324418967a",
  "name" : "One Hour",
  "loanable" : true,
  "loansPolicy" : {
    "profileId" : "Rolling",
    "period" : {
      "duration" : 1,
      "intervalId" : "Hours"
    },
    "closedLibraryDueDateManagementId" : "CURRENT_DUE_DATE_TIME"
  },
  "renewable" : true,
  "renewalsPolicy" : {
    "unlimited" : false,
    "numberAllowed": 3,
    "renewFromId" : "SYSTEM_DATE",
    "differentPeriod" : false
  }
}
